tunecache.tsv
tunecache	0.7.0	cpu_arch=x86_64,gpu_arch=sm_35,cuda_version=5050	# Last updated Tue Jun  9 10:01:28 2015

volume	name	aux	block.x	block.y	block.z	grid.x	grid.y	grid.z	shared_bytes	comment
24x48x48x4	N4quda11axpyCGNorm2I7double26float26float4EE	vol=221184,stride=221184,precision=4,TwistFlavour=-1	128	1	1	97	1	1	2048	# 80.54 Gflop/s, 161.07 GB/s, tuned Wed Feb 25 07:38:43 2015
24x48x48x4	N4quda11axpyCGNorm2I7double26float26float4EE	vol=221184,stride=221184,precision=4,TwistFlavour=1	128	1	1	98	1	1	2048	# 80.75 Gflop/s, 161.50 GB/s, tuned Wed Feb 25 01:59:58 2015
24x48x48x4	N4quda16WilsonDslashCudaI7double2S1_EE	type=exterior_t,comm=0001,reconstruct=18,Xpay	448	1	1	494	1	1	8193	# 560.60 Gflop/s, 0.00 GB/s, tuned Wed Feb 25 09:16:39 2015
24x48x48x4	N4quda16WilsonDslashCudaI7double2S1_EE	type=exterior_t,comm=0001,reconstruct=8,Xpay	64	1	1	3456	1	1	0	# 582.03 Gflop/s, 0.00 GB/s, tuned Wed Feb 25 01:58:34 2015
24x48x48x4	N4quda16WilsonDslashCudaI7double2S1_EE	type=interior,comm=0001,ghost=0001,reconstruct=18,Xpay	256	1	1	864	1	1	6145	# 109.50 Gflop/s, 0.00 GB/s, tuned Wed Feb 25 09:16:39 2015
24x48x48x4	N4quda16WilsonDslashCudaI7double2S1_EE	type=interior,comm=0001,ghost=0001,reconstruct=8,Xpay	96	1	1	2304	1	1	0	# 140.11 Gflop/s, 0.00 GB/s, tuned Wed Feb 25 01:58:34 2015
24x48x48x4	N4quda21TwistCloverGamma5CudaI7double2S1_EE	vol=221184,stride=221184,precision=8,TwistFlavour=-1	384	1	1	576	1	1	0	# 2.62 Gflop/s, 52.48 GB/s, tuned Wed Feb 25 07:37:29 2015
24x48x48x4	N4quda21TwistCloverGamma5CudaI7double2S1_EE	vol=221184,stride=221184,precision=8,TwistFlavour=1	384	1	1	576	1	1	0	# 2.60 Gflop/s, 52.08 GB/s, tuned Wed Feb 25 01:58:34 2015
24x48x48x4	N4quda22HeavyQuarkResidualNormI7double37double2S2_EE	vol=221184,stride=221184,precision=8,TwistFlavour=-1	64	1	1	112	1	1	1536	# 42.37 Gflop/s, 169.46 GB/s, tuned Wed Feb 25 07:38:23 2015
24x48x48x4	N4quda22HeavyQuarkResidualNormI7double37double2S2_EE	vol=221184,stride=221184,precision=8,TwistFlavour=1	96	1	1	56	1	1	2304	# 42.16 Gflop/s, 168.66 GB/s, tuned Wed Feb 25 01:59:36 2015
24x48x48x4	N4quda23TwistedCloverDslashCudaI6float4S1_S1_EE	type=exterior_t,comm=0001,reconstruct=18,Dslash	640	1	1	346	1	1	12289	# 524.33 Gflop/s, 0.00 GB/s, tuned Wed Feb 25 09:16:46 2015
24x48x48x4	N4quda23TwistedCloverDslashCudaI6float4S1_S1_EE	type=exterior_t,comm=0001,reconstruct=18,Xpay,DslashCloverTwist	160	1	1	1383	1	1	0	# 681.15 Gflop/s, 0.00 GB/s, tuned Wed Feb 25 09:16:47 2015
24x48x48x4	N4quda23TwistedCloverDslashCudaI6float4S1_S1_EE	type=exterior_t,comm=0001,reconstruct=18,Xpay,dagger,DslashCloverTwist	288	1	1	768	1	1	7022	# 687.85 Gflop/s, 0.00 GB/s, tuned Wed Feb 25 09:16:48 2015
24x48x48x4	N4quda23TwistedCloverDslashCudaI6float4S1_S1_EE	type=exterior_t,comm=0001,reconstruct=18,dagger,Dslash	640	1	1	346	1	1	12289	# 522.96 Gflop/s, 0.00 GB/s, tuned Wed Feb 25 09:16:47 2015
24x48x48x4	N4quda23TwistedCloverDslashCudaI6float4S1_S1_EE	type=exterior_t,comm=0001,reconstruct=8,Dslash	160	1	1	1383	1	1	0	# 539.93 Gflop/s, 0.00 GB/s, tuned Wed Feb 25 01:59:36 2015
24x48x48x4	N4quda23TwistedCloverDslashCudaI6float4S1_S1_EE	type=exterior_t,comm=0001,reconstruct=8,Xpay,DslashCloverTwist	64	1	1	3456	1	1	0	# 714.98 Gflop/s, 0.00 GB/s, tuned Wed Feb 25 01:59:37 2015
24x48x48x4	N4quda23TwistedCloverDslashCudaI6float4S1_S1_EE	type=exterior_t,comm=0001,reconstruct=8,Xpay,dagger,DslashCloverTwist	576	1	1	384	1	1	8193	# 713.47 Gflop/s, 0.00 GB/s, tuned Wed Feb 25 01:59:37 2015
24x48x48x4	N4quda23TwistedCloverDslashCudaI6float4S1_S1_EE	type=exterior_t,comm=0001,reconstruct=8,dagger,Dslash	320	1	1	692	1	1	6145	# 541.05 Gflop/s, 0.00 GB/s, tuned Wed Feb 25 01:59:37 2015
24x48x48x4	N4quda23TwistedCloverDslashCudaI6float4S1_S1_EE	type=interior,comm=0001,ghost=0001,reconstruct=18,Dslash	256	1	1	864	1	1	7022	# 188.33 Gflop/s, 0.00 GB/s, tuned Wed Feb 25 09:16:46 2015
24x48x48x4	N4quda23TwistedCloverDslashCudaI6float4S1_S1_EE	type=interior,comm=0001,ghost=0001,reconstruct=18,Xpay,DslashCloverTwist	224	1	1	988	1	1	0	# 211.17 Gflop/s, 0.00 GB/s, tuned Wed Feb 25 09:16:47 2015
24x48x48x4	N4quda23TwistedCloverDslashCudaI6float4S1_S1_EE	type=interior,comm=0001,ghost=0001,reconstruct=18,Xpay,dagger,DslashCloverTwist	224	1	1	988	1	1	0	# 211.59 Gflop/s, 0.00 GB/s, tuned Wed Feb 25 09:16:47 2015
24x48x48x4	N4quda23TwistedCloverDslashCudaI6float4S1_S1_EE	type=interior,comm=0001,ghost=0001,reconstruct=18,dagger,Dslash	224	1	1	988	1	1	0	# 188.72 Gflop/s, 0.00 GB/s, tuned Wed Feb 25 09:16:47 2015
24x48x48x4	N4quda23TwistedCloverDslashCudaI6float4S1_S1_EE	type=interior,comm=0001,ghost=0001,reconstruct=8,Dslash	160	1	1	1383	1	1	0	# 251.02 Gflop/s, 0.00 GB/s, tuned Wed Feb 25 01:59:36 2015
24x48x48x4	N4quda23TwistedCloverDslashCudaI6float4S1_S1_EE	type=interior,comm=0001,ghost=0001,reconstruct=8,Xpay,DslashCloverTwist	640	1	1	346	1	1	16385	# 285.23 Gflop/s, 0.00 GB/s, tuned Wed Feb 25 01:59:36 2015
24x48x48x4	N4quda23TwistedCloverDslashCudaI6float4S1_S1_EE	type=interior,comm=0001,ghost=0001,reconstruct=8,Xpay,dagger,DslashCloverTwist	640	1	1	346	1	1	6145	# 286.48 Gflop/s, 0.00 GB/s, tuned Wed Feb 25 01:59:37 2015
24x48x48x4	N4quda23TwistedCloverDslashCudaI6float4S1_S1_EE	type=interior,comm=0001,ghost=0001,reconstruct=8,dagger,Dslash	64	1	1	3456	1	1	0	# 249.52 Gflop/s, 0.00 GB/s, tuned Wed Feb 25 01:59:37 2015
24x48x48x4	N4quda23TwistedCloverDslashCudaI7double2S1_S1_EE	type=exterior_t,comm=0001,reconstruct=18,Dslash	128	1	1	1728	1	1	7022	# 253.61 Gflop/s, 0.00 GB/s, tuned Wed Feb 25 09:16:45 2015
24x48x48x4	N4quda23TwistedCloverDslashCudaI7double2S1_S1_EE	type=exterior_t,comm=0001,reconstruct=18,Xpay,DslashCloverTwist	384	1	1	576	1	1	16385	# 343.82 Gflop/s, 0.00 GB/s, tuned Wed Feb 25 09:16:46 2015
24x48x48x4	N4quda23TwistedCloverDslashCudaI7double2S1_S1_EE	type=exterior_t,comm=0001,reconstruct=18,Xpay,dagger,DslashCloverTwist	192	1	1	1152	1	1	7022	# 344.63 Gflop/s, 0.00 GB/s, tuned Wed Feb 25 09:16:40 2015
24x48x48x4	N4quda23TwistedCloverDslashCudaI7double2S1_S1_EE	type=exterior_t,comm=0001,reconstruct=18,dagger,Dslash	256	1	1	864	1	1	24577	# 253.81 Gflop/s, 0.00 GB/s, tuned Wed Feb 25 09:16:39 2015
24x48x48x4	N4quda23TwistedCloverDslashCudaI7double2S1_S1_EE	type=exterior_t,comm=0001,reconstruct=8,Dslash	64	1	1	3456	1	1	0	# 261.15 Gflop/s, 0.00 GB/s, tuned Wed Feb 25 01:58:53 2015
24x48x48x4	N4quda23TwistedCloverDslashCudaI7double2S1_S1_EE	type=exterior_t,comm=0001,reconstruct=8,Xpay,DslashCloverTwist	128	1	1	1728	1	1	16385	# 323.98 Gflop/s, 0.00 GB/s, tuned Wed Feb 25 01:58:54 2015
24x48x48x4	N4quda23TwistedCloverDslashCudaI7double2S1_S1_EE	type=exterior_t,comm=0001,reconstruct=8,Xpay,dagger,DslashCloverTwist	64	1	1	3456	1	1	0	# 325.39 Gflop/s, 0.00 GB/s, tuned Wed Feb 25 01:58:36 2015
24x48x48x4	N4quda23TwistedCloverDslashCudaI7double2S1_S1_EE	type=exterior_t,comm=0001,reconstruct=8,dagger,Dslash	128	1	1	1728	1	1	0	# 260.17 Gflop/s, 0.00 GB/s, tuned Wed Feb 25 01:58:35 2015
24x48x48x4	N4quda23TwistedCloverDslashCudaI7double2S1_S1_EE	type=interior,comm=0001,ghost=0001,reconstruct=18,Dslash	128	1	1	1728	1	1	0	# 91.84 Gflop/s, 0.00 GB/s, tuned Wed Feb 25 09:16:45 2015
24x48x48x4	N4quda23TwistedCloverDslashCudaI7double2S1_S1_EE	type=interior,comm=0001,ghost=0001,reconstruct=18,Xpay,DslashCloverTwist	128	1	1	1728	1	1	16385	# 100.93 Gflop/s, 0.00 GB/s, tuned Wed Feb 25 09:16:46 2015
24x48x48x4	N4quda23TwistedCloverDslashCudaI7double2S1_S1_EE	type=interior,comm=0001,ghost=0001,reconstruct=18,Xpay,dagger,DslashCloverTwist	128	1	1	1728	1	1	16385	# 101.19 Gflop/s, 0.00 GB/s, tuned Wed Feb 25 09:16:40 2015
24x48x48x4	N4quda23TwistedCloverDslashCudaI7double2S1_S1_EE	type=interior,comm=0001,ghost=0001,reconstruct=18,dagger,Dslash	128	1	1	1728	1	1	7022	# 92.07 Gflop/s, 0.00 GB/s, tuned Wed Feb 25 09:16:39 2015
24x48x48x4	N4quda23TwistedCloverDslashCudaI7double2S1_S1_EE	type=interior,comm=0001,ghost=0001,reconstruct=8,Dslash	128	1	1	1728	1	1	0	# 88.82 Gflop/s, 0.00 GB/s, tuned Wed Feb 25 01:58:53 2015
24x48x48x4	N4quda23TwistedCloverDslashCudaI7double2S1_S1_EE	type=interior,comm=0001,ghost=0001,reconstruct=8,Xpay,DslashCloverTwist	32	1	1	6912	1	1	0	# 83.98 Gflop/s, 0.00 GB/s, tuned Wed Feb 25 01:58:53 2015
24x48x48x4	N4quda23TwistedCloverDslashCudaI7double2S1_S1_EE	type=interior,comm=0001,ghost=0001,reconstruct=8,Xpay,dagger,DslashCloverTwist	64	1	1	3456	1	1	0	# 84.00 Gflop/s, 0.00 GB/s, tuned Wed Feb 25 01:58:36 2015
24x48x48x4	N4quda23TwistedCloverDslashCudaI7double2S1_S1_EE	type=interior,comm=0001,ghost=0001,reconstruct=8,dagger,Dslash	64	1	1	3456	1	1	0	# 71.17 Gflop/s, 0.00 GB/s, tuned Wed Feb 25 01:58:35 2015
24x48x48x4	N4quda25xpyHeavyQuarkResidualNormI7double37double2S2_EE	vol=221184,stride=221184,precision=8,TwistFlavour=-1	128	1	1	56	1	1	3072	# 35.66 Gflop/s, 171.15 GB/s, tuned Wed Feb 25 07:39:28 2015
24x48x48x4	N4quda25xpyHeavyQuarkResidualNormI7double37double2S2_EE	vol=221184,stride=221184,precision=8,TwistFlavour=1	128	1	1	56	1	1	3072	# 35.53 Gflop/s, 170.56 GB/s, tuned Wed Feb 25 02:00:43 2015
24x48x48x4	N4quda3DotId6float26float4EE	vol=221184,stride=221184,precision=4,TwistFlavour=-1	96	1	1	224	1	1	768	# 42.54 Gflop/s, 170.14 GB/s, tuned Wed Feb 25 07:38:31 2015
24x48x48x4	N4quda3DotId6float26float4EE	vol=221184,stride=221184,precision=4,TwistFlavour=1	128	1	1	168	1	1	1024	# 42.60 Gflop/s, 170.41 GB/s, tuned Wed Feb 25 01:59:45 2015
24x48x48x4	N4quda3xpyI7double2S1_EE	vol=221184,stride=221184,precision=8,TwistFlavour=-1	576	1	1	248	1	1	0	# 7.39 Gflop/s, 177.33 GB/s, tuned Wed Feb 25 07:40:01 2015
24x48x48x4	N4quda3xpyI7double2S1_EE	vol=221184,stride=221184,precision=8,TwistFlavour=1	544	1	1	251	1	1	0	# 7.40 Gflop/s, 177.59 GB/s, tuned Wed Feb 25 02:01:16 2015
24x48x48x4	N4quda4axpyI6float26float4EE	vol=221184,stride=221184,precision=4,TwistFlavour=-1	576	1	1	249	1	1	0	# 29.78 Gflop/s, 178.68 GB/s, tuned Wed Feb 25 07:40:11 2015
24x48x48x4	N4quda4axpyI6float26float4EE	vol=221184,stride=221184,precision=4,TwistFlavour=1	896	1	1	246	1	1	0	# 29.77 Gflop/s, 178.61 GB/s, tuned Wed Feb 25 02:01:26 2015
24x48x48x4	N4quda4axpyI7double2S1_EE	vol=221184,stride=221184,precision=4,TwistFlavour=-1,vol=221184,stride=221184,precision=8,TwistFlavour=-1	256	1	1	14	1	1	0	# 16.78 Gflop/s, 100.70 GB/s, tuned Wed Feb 25 07:39:41 2015
24x48x48x4	N4quda4axpyI7double2S1_EE	vol=221184,stride=221184,precision=4,TwistFlavour=-1,vol=221184,stride=221184,precision=8,TwistFlavour=1	384	1	1	9	1	1	0	# 16.83 Gflop/s, 101.00 GB/s, tuned Wed Feb 25 15:23:07 2015
24x48x48x4	N4quda4axpyI7double2S1_EE	vol=221184,stride=221184,precision=4,TwistFlavour=1,vol=221184,stride=221184,precision=8,TwistFlavour=1	256	1	1	12	1	1	0	# 16.78 Gflop/s, 100.66 GB/s, tuned Wed Feb 25 02:00:56 2015
24x48x48x4	N4quda4xpayI6float26float4EE	vol=221184,stride=221184,precision=4,TwistFlavour=-1	832	1	1	251	1	1	0	# 29.79 Gflop/s, 178.73 GB/s, tuned Wed Feb 25 07:40:22 2015
24x48x48x4	N4quda4xpayI6float26float4EE	vol=221184,stride=221184,precision=4,TwistFlavour=1	864	1	1	249	1	1	0	# 29.81 Gflop/s, 178.83 GB/s, tuned Wed Feb 25 02:01:37 2015
24x48x48x4	N4quda5Norm2Id7double2S1_EE	vol=221184,stride=221184,precision=8,TwistFlavour=-1	224	1	1	224	1	1	1792	# 40.85 Gflop/s, 163.40 GB/s, tuned Wed Feb 25 07:37:41 2015
24x48x48x4	N4quda5Norm2Id7double2S1_EE	vol=221184,stride=221184,precision=8,TwistFlavour=1	224	1	1	219	1	1	1792	# 40.79 Gflop/s, 163.15 GB/s, tuned Wed Feb 25 01:58:52 2015
24x48x48x4	N4quda8axpyZpbxI7double2S1_EE	vol=221184,stride=221184,precision=4,TwistFlavour=-1,vol=221184,stride=221184,precision=8,TwistFlavour=-1	32	1	1	123	1	1	0	# 46.64 Gflop/s, 116.61 GB/s, tuned Wed Feb 25 07:39:02 2015
24x48x48x4	N4quda8axpyZpbxI7double2S1_EE	vol=221184,stride=221184,precision=4,TwistFlavour=-1,vol=221184,stride=221184,precision=8,TwistFlavour=1	32	1	1	123	1	1	0	# 46.70 Gflop/s, 116.74 GB/s, tuned Wed Feb 25 15:22:53 2015
24x48x48x4	N4quda8axpyZpbxI7double2S1_EE	vol=221184,stride=221184,precision=4,TwistFlavour=1,vol=221184,stride=221184,precision=8,TwistFlavour=1	32	1	1	128	1	1	0	# 46.85 Gflop/s, 117.13 GB/s, tuned Wed Feb 25 02:00:17 2015
24x48x48x4	N4quda8xmyNorm2Id7double2S1_EE	vol=221184,stride=221184,precision=8,TwistFlavour=-1	128	1	1	168	1	1	1024	# 21.40 Gflop/s, 171.21 GB/s, tuned Wed Feb 25 07:38:02 2015
24x48x48x4	N4quda8xmyNorm2Id7double2S1_EE	vol=221184,stride=221184,precision=8,TwistFlavour=1	192	1	1	112	1	1	1536	# 21.40 Gflop/s, 171.18 GB/s, tuned Wed Feb 25 01:59:15 2015
24x48x48x4	copyKernel	dst=vol=221184,stride=221184,precision=4,TwistFlavour=-1,src=vol=221184,stride=221184,precision=8,TwistFlavour=-1	448	1	1	252	1	1	0	# 0.00 Gflop/s, 174.25 GB/s, tuned Wed Feb 25 07:38:12 2015
24x48x48x4	copyKernel	dst=vol=221184,stride=221184,precision=4,TwistFlavour=1,src=vol=221184,stride=221184,precision=8,TwistFlavour=1	896	1	1	238	1	1	0	# 0.00 Gflop/s, 174.01 GB/s, tuned Wed Feb 25 01:59:25 2015
24x48x48x4	copyKernel	dst=vol=221184,stride=221184,precision=8,TwistFlavour=-1,src=vol=221184,stride=221184,precision=4,TwistFlavour=-1	992	1	1	233	1	1	0	# 0.00 Gflop/s, 164.86 GB/s, tuned Wed Feb 25 07:39:13 2015
24x48x48x4	copyKernel	dst=vol=221184,stride=221184,precision=8,TwistFlavour=1,src=vol=221184,stride=221184,precision=4,TwistFlavour=1	992	1	1	249	1	1	0	# 0.00 Gflop/s, 163.94 GB/s, tuned Wed Feb 25 02:00:28 2015
24x48x48x6	N4quda10CovDevCudaId7double2EE	type=exterior_t,comm=0000,reconstruct=8	494	1	1	112	1	1	6145	# 2.99 Gflop/s, 0.00 GB/s, tuned Tue Jun  9 10:00:48 2015
24x48x48x6	N4quda10CovDevCudaId7double2EE	type=exterior_t,comm=0000,reconstruct=8,dagger	232	1	1	239	1	1	6145	# 2.98 Gflop/s, 0.00 GB/s, tuned Tue Jun  9 10:01:24 2015
24x48x48x6	N4quda10CovDevCudaId7double2EE	type=interior,comm=0000,ghost=0000,reconstruct=8	240	1	1	1383	1	1	16385	# 53.10 Gflop/s, 0.00 GB/s, tuned Tue Jun  9 10:00:09 2015
24x48x48x6	N4quda10CovDevCudaId7double2EE	type=interior,comm=0000,ghost=0000,reconstruct=8,dagger	232	1	1	1431	1	1	0	# 53.08 Gflop/s, 0.00 GB/s, tuned Tue Jun  9 10:00:12 2015
24x48x48x6	N4quda10Gamma5CudaI7double2EE	type=default	288	1	1	1152	1	1	9831	# 5.26 Gflop/s, 196.48 GB/s, tuned Sun Mar  1 23:20:36 2015
24x48x48x6	N4quda11axpyCGNorm2I7double26float26float4EE	vol=331776,stride=331776,precision=4,TwistFlavour=-1	128	1	1	98	1	1	2048	# 81.72 Gflop/s, 163.44 GB/s, tuned Sun Mar  1 23:17:37 2015
24x48x48x6	N4quda12ContractCudaI7double2S1_EE	type=gamma5	96	1	1	3456	1	1	24576	# 13.68 Gflop/s, 51.07 GB/s, tuned Sun Mar  1 23:20:36 2015
24x48x48x6	N4quda12ContractCudaI7double2S1_EE	type=gamma5-minus	96	1	1	3456	1	1	24576	# 7.87 Gflop/s, 29.38 GB/s, tuned Tue Jun  9 10:00:12 2015
24x48x48x6	N4quda12ContractCudaI7double2S1_EE	type=gamma5-plus	96	1	1	3456	1	1	24576	# 7.87 Gflop/s, 29.38 GB/s, tuned Tue Jun  9 10:00:12 2015
24x48x48x6	N4quda16WilsonDslashCudaI7double2S1_EE	type=exterior_t,comm=0001,reconstruct=8,Xpay	192	1	1	1728	1	1	16385	# 856.13 Gflop/s, 0.00 GB/s, tuned Sun Mar  1 23:15:40 2015
24x48x48x6	N4quda16WilsonDslashCudaI7double2S1_EE	type=interior,comm=0001,ghost=0001,reconstruct=8,Xpay	128	1	1	2592	1	1	0	# 137.27 Gflop/s, 0.00 GB/s, tuned Sun Mar  1 23:15:40 2015
24x48x48x6	N4quda20AsymCloverDslashCudaI7double2S1_S1_EE	type=exterior_t,comm=0001,reconstruct=8,Xpay	128	1	1	2592	1	1	0	# 1489.33 Gflop/s, 0.00 GB/s, tuned Sun Mar  1 23:20:35 2015
24x48x48x6	N4quda20AsymCloverDslashCudaI7double2S1_S1_EE	type=interior,comm=0001,ghost=0001,reconstruct=8,Xpay	64	1	1	5184	1	1	0	# 91.75 Gflop/s, 0.00 GB/s, tuned Sun Mar  1 23:20:35 2015
24x48x48x6	N4quda21TwistCloverGamma5CudaI7double2S1_EE	vol=331776,stride=331776,precision=8,TwistFlavour=-1	384	1	1	864	1	1	7022	# 2.65 Gflop/s, 49.48 GB/s, tuned Sun Mar  1 23:15:39 2015
24x48x48x6	N4quda22HeavyQuarkResidualNormI7double37double2S2_EE	vol=331776,stride=331776,precision=8,TwistFlavour=-1	192	1	1	27	1	1	4608	# 43.21 Gflop/s, 172.85 GB/s, tuned Sun Mar  1 23:17:05 2015
24x48x48x6	N4quda23TwistedCloverDslashCudaI6float4S1_S1_EE	type=exterior_t,comm=0001,reconstruct=8,Dslash	128	1	1	2592	1	1	0	# 812.54 Gflop/s, 0.00 GB/s, tuned Sun Mar  1 23:17:06 2015
24x48x48x6	N4quda23TwistedCloverDslashCudaI6float4S1_S1_EE	type=exterior_t,comm=0001,reconstruct=8,Xpay,DslashCloverTwist	160	1	1	2074	1	1	0	# 1068.49 Gflop/s, 0.00 GB/s, tuned Sun Mar  1 23:17:06 2015
24x48x48x6	N4quda23TwistedCloverDslashCudaI6float4S1_S1_EE	type=exterior_t,comm=0001,reconstruct=8,Xpay,dagger,DslashCloverTwist	64	1	1	5184	1	1	0	# 1067.95 Gflop/s, 0.00 GB/s, tuned Sun Mar  1 23:17:08 2015
24x48x48x6	N4quda23TwistedCloverDslashCudaI6float4S1_S1_EE	type=exterior_t,comm=0001,reconstruct=8,dagger,Dslash	640	1	1	519	1	1	16385	# 809.80 Gflop/s, 0.00 GB/s, tuned Sun Mar  1 23:17:07 2015
24x48x48x6	N4quda23TwistedCloverDslashCudaI6float4S1_S1_EE	type=interior,comm=0001,ghost=0001,reconstruct=8,Dslash	128	1	1	2592	1	1	0	# 226.44 Gflop/s, 0.00 GB/s, tuned Sun Mar  1 23:17:06 2015
24x48x48x6	N4quda23TwistedCloverDslashCudaI6float4S1_S1_EE	type=interior,comm=0001,ghost=0001,reconstruct=8,Xpay,DslashCloverTwist	640	1	1	519	1	1	0	# 266.18 Gflop/s, 0.00 GB/s, tuned Sun Mar  1 23:17:06 2015
24x48x48x6	N4quda23TwistedCloverDslashCudaI6float4S1_S1_EE	type=interior,comm=0001,ghost=0001,reconstruct=8,Xpay,dagger,DslashCloverTwist	640	1	1	519	1	1	7022	# 265.71 Gflop/s, 0.00 GB/s, tuned Sun Mar  1 23:17:07 2015
24x48x48x6	N4quda23TwistedCloverDslashCudaI6float4S1_S1_EE	type=interior,comm=0001,ghost=0001,reconstruct=8,dagger,Dslash	320	1	1	1037	1	1	6145	# 225.23 Gflop/s, 0.00 GB/s, tuned Sun Mar  1 23:17:07 2015
24x48x48x6	N4quda23TwistedCloverDslashCudaI7double2S1_S1_EE	type=exterior_t,comm=0001,reconstruct=8,Dslash	64	1	1	5184	1	1	0	# 391.31 Gflop/s, 0.00 GB/s, tuned Sun Mar  1 23:16:02 2015
24x48x48x6	N4quda23TwistedCloverDslashCudaI7double2S1_S1_EE	type=exterior_t,comm=0001,reconstruct=8,Xpay,DslashCloverTwist	128	1	1	2592	1	1	0	# 485.31 Gflop/s, 0.00 GB/s, tuned Sun Mar  1 23:16:03 2015
24x48x48x6	N4quda23TwistedCloverDslashCudaI7double2S1_S1_EE	type=exterior_t,comm=0001,reconstruct=8,Xpay,dagger,DslashCloverTwist	128	1	1	2592	1	1	7022	# 486.19 Gflop/s, 0.00 GB/s, tuned Sun Mar  1 23:15:42 2015
24x48x48x6	N4quda23TwistedCloverDslashCudaI7double2S1_S1_EE	type=exterior_t,comm=0001,reconstruct=8,dagger,Dslash	128	1	1	2592	1	1	7022	# 390.27 Gflop/s, 0.00 GB/s, tuned Sun Mar  1 23:15:41 2015
24x48x48x6	N4quda23TwistedCloverDslashCudaI7double2S1_S1_EE	type=interior,comm=0001,ghost=0001,reconstruct=8,Dslash	64	1	1	5184	1	1	0	# 76.81 Gflop/s, 0.00 GB/s, tuned Sun Mar  1 23:16:02 2015
24x48x48x6	N4quda23TwistedCloverDslashCudaI7double2S1_S1_EE	type=interior,comm=0001,ghost=0001,reconstruct=8,Xpay,DslashCloverTwist	32	1	1	10368	1	1	0	# 73.86 Gflop/s, 0.00 GB/s, tuned Sun Mar  1 23:16:03 2015
24x48x48x6	N4quda23TwistedCloverDslashCudaI7double2S1_S1_EE	type=interior,comm=0001,ghost=0001,reconstruct=8,Xpay,dagger,DslashCloverTwist	64	1	1	5184	1	1	0	# 74.41 Gflop/s, 0.00 GB/s, tuned Sun Mar  1 23:15:42 2015
24x48x48x6	N4quda23TwistedCloverDslashCudaI7double2S1_S1_EE	type=interior,comm=0001,ghost=0001,reconstruct=8,dagger,Dslash	128	1	1	2592	1	1	6145	# 62.21 Gflop/s, 0.00 GB/s, tuned Sun Mar  1 23:15:41 2015
24x48x48x6	N4quda25xpyHeavyQuarkResidualNormI7double37double2S2_EE	vol=331776,stride=331776,precision=8,TwistFlavour=-1	192	1	1	27	1	1	4608	# 36.20 Gflop/s, 173.77 GB/s, tuned Sun Mar  1 23:18:44 2015
24x48x48x6	N4quda3DotId6float26float4EE	vol=331776,stride=331776,precision=4,TwistFlavour=-1	224	1	1	112	1	1	1792	# 43.85 Gflop/s, 175.41 GB/s, tuned Sun Mar  1 23:17:19 2015
24x48x48x6	N4quda3xpyI7double2S1_EE	vol=331776,stride=331776,precision=8,TwistFlavour=-1	544	1	1	249	1	1	0	# 7.38 Gflop/s, 177.17 GB/s, tuned Sun Mar  1 23:19:33 2015
24x48x48x6	N4quda4axpyI6float26float4EE	vol=331776,stride=331776,precision=4,TwistFlavour=-1	576	1	1	250	1	1	0	# 29.79 Gflop/s, 178.77 GB/s, tuned Sun Mar  1 23:19:48 2015
24x48x48x6	N4quda4axpyI7double2S1_EE	vol=331776,stride=331776,precision=4,TwistFlavour=-1,vol=331776,stride=331776,precision=8,TwistFlavour=-1	256	1	1	14	1	1	0	# 17.07 Gflop/s, 102.41 GB/s, tuned Sun Mar  1 23:19:03 2015
24x48x48x6	N4quda4xpayI6float26float4EE	vol=331776,stride=331776,precision=4,TwistFlavour=-1	544	1	1	251	1	1	0	# 29.78 Gflop/s, 178.67 GB/s, tuned Sun Mar  1 23:20:04 2015
24x48x48x6	N4quda5Norm2Id7double2S1_EE	vol=331776,stride=331776,precision=8,TwistFlavour=-1	256	1	1	96	1	1	2048	# 41.80 Gflop/s, 167.21 GB/s, tuned Sun Mar  1 23:16:01 2015
24x48x48x6	N4quda8axpyZpbxI7double2S1_EE	vol=331776,stride=331776,precision=4,TwistFlavour=-1,vol=331776,stride=331776,precision=8,TwistFlavour=-1	32	1	1	126	1	1	0	# 47.04 Gflop/s, 117.60 GB/s, tuned Sun Mar  1 23:18:06 2015
24x48x48x6	N4quda8xmyNorm2Id7double2S1_EE	vol=331776,stride=331776,precision=8,TwistFlavour=-1	192	1	1	112	1	1	1536	# 21.46 Gflop/s, 171.69 GB/s, tuned Sun Mar  1 23:16:35 2015
24x48x48x6	copyKernel	dst=vol=331776,stride=331776,precision=4,TwistFlavour=-1,src=vol=331776,stride=331776,precision=8,TwistFlavour=-1	896	1	1	205	1	1	0	# 0.00 Gflop/s, 174.07 GB/s, tuned Sun Mar  1 23:16:50 2015
24x48x48x6	copyKernel	dst=vol=331776,stride=331776,precision=8,TwistFlavour=-1,src=vol=331776,stride=331776,precision=4,TwistFlavour=-1	1024	1	1	237	1	1	0	# 0.00 Gflop/s, 163.00 GB/s, tuned Sun Mar  1 23:18:21 2015
24x48x48x8	N4quda10Gamma5CudaI7double2EE	type=default	672	1	1	659	1	1	8193	# 5.14 Gflop/s, 185.17 GB/s, tuned Wed Feb 25 18:26:27 2015
24x48x48x8	N4quda11axpyCGNorm2I7double26float26float4EE	vol=442368,stride=442368,precision=4,TwistFlavour=-1	1024	1	1	27	1	1	16384	# 82.60 Gflop/s, 165.19 GB/s, tuned Wed Feb 25 08:02:39 2015
24x48x48x8	N4quda11axpyCGNorm2I7double26float26float4EE	vol=442368,stride=442368,precision=4,TwistFlavour=1	1024	1	1	80	1	1	16384	# 82.48 Gflop/s, 164.95 GB/s, tuned Tue Feb 24 12:05:04 2015
24x48x48x8	N4quda12ContractCudaI7double2S1_EE	type=gamma5	96	1	1	4608	1	1	24576	# 13.57 Gflop/s, 48.84 GB/s, tuned Wed Feb 25 18:26:27 2015
24x48x48x8	N4quda16WilsonDslashCudaI7double2S1_EE	type=exterior_t,comm=0001,reconstruct=8,Xpay	128	1	1	3456	1	1	0	# 1137.18 Gflop/s, 0.00 GB/s, tuned Tue Feb 24 12:02:43 2015
24x48x48x8	N4quda16WilsonDslashCudaI7double2S1_EE	type=interior,comm=0001,ghost=0001,reconstruct=8,Xpay	64	1	1	6912	1	1	0	# 135.63 Gflop/s, 0.00 GB/s, tuned Tue Feb 24 12:02:43 2015
24x48x48x8	N4quda20AsymCloverDslashCudaI7double2S1_S1_EE	type=exterior_t,comm=0001,reconstruct=8,Xpay	128	1	1	3456	1	1	0	# 1934.99 Gflop/s, 0.00 GB/s, tuned Wed Feb 25 18:26:26 2015
24x48x48x8	N4quda20AsymCloverDslashCudaI7double2S1_S1_EE	type=interior,comm=0001,ghost=0001,reconstruct=8,Xpay	128	1	1	3456	1	1	7022	# 89.32 Gflop/s, 0.00 GB/s, tuned Wed Feb 25 18:26:26 2015
24x48x48x8	N4quda21TwistCloverGamma5CudaI7double2S1_EE	vol=442368,stride=442368,precision=8,TwistFlavour=-1	384	1	1	1152	1	1	7022	# 2.62 Gflop/s, 47.22 GB/s, tuned Wed Feb 25 08:00:18 2015
24x48x48x8	N4quda21TwistCloverGamma5CudaI7double2S1_EE	vol=442368,stride=442368,precision=8,TwistFlavour=1	384	1	1	1152	1	1	16385	# 2.62 Gflop/s, 47.21 GB/s, tuned Tue Feb 24 12:02:42 2015
24x48x48x8	N4quda22HeavyQuarkResidualNormI7double37double2S2_EE	vol=442368,stride=442368,precision=8,TwistFlavour=-1	64	1	1	112	1	1	1536	# 43.36 Gflop/s, 173.45 GB/s, tuned Wed Feb 25 08:02:01 2015
24x48x48x8	N4quda22HeavyQuarkResidualNormI7double37double2S2_EE	vol=442368,stride=442368,precision=8,TwistFlavour=1	128	1	1	42	1	1	3072	# 43.29 Gflop/s, 173.18 GB/s, tuned Tue Feb 24 12:04:23 2015
24x48x48x8	N4quda23TwistedCloverDslashCudaI6float4S1_S1_EE	type=exterior_t,comm=0001,reconstruct=8,Dslash	640	1	1	692	1	1	24577	# 1068.82 Gflop/s, 0.00 GB/s, tuned Tue Feb 24 12:04:24 2015
24x48x48x8	N4quda23TwistedCloverDslashCudaI6float4S1_S1_EE	type=exterior_t,comm=0001,reconstruct=8,Xpay,DslashCloverTwist	160	1	1	2765	1	1	0	# 1414.67 Gflop/s, 0.00 GB/s, tuned Tue Feb 24 12:04:25 2015
24x48x48x8	N4quda23TwistedCloverDslashCudaI6float4S1_S1_EE	type=exterior_t,comm=0001,reconstruct=8,Xpay,dagger,DslashCloverTwist	64	1	1	6912	1	1	0	# 1409.17 Gflop/s, 0.00 GB/s, tuned Tue Feb 24 12:04:26 2015
24x48x48x8	N4quda23TwistedCloverDslashCudaI6float4S1_S1_EE	type=exterior_t,comm=0001,reconstruct=8,dagger,Dslash	640	1	1	692	1	1	0	# 1069.00 Gflop/s, 0.00 GB/s, tuned Tue Feb 24 12:04:26 2015
24x48x48x8	N4quda23TwistedCloverDslashCudaI6float4S1_S1_EE	type=interior,comm=0001,ghost=0001,reconstruct=8,Dslash	128	1	1	3456	1	1	0	# 214.98 Gflop/s, 0.00 GB/s, tuned Tue Feb 24 12:04:24 2015
24x48x48x8	N4quda23TwistedCloverDslashCudaI6float4S1_S1_EE	type=interior,comm=0001,ghost=0001,reconstruct=8,Xpay,DslashCloverTwist	640	1	1	692	1	1	6145	# 254.16 Gflop/s, 0.00 GB/s, tuned Tue Feb 24 12:04:25 2015
24x48x48x8	N4quda23TwistedCloverDslashCudaI6float4S1_S1_EE	type=interior,comm=0001,ghost=0001,reconstruct=8,Xpay,dagger,DslashCloverTwist	640	1	1	692	1	1	7022	# 255.01 Gflop/s, 0.00 GB/s, tuned Tue Feb 24 12:04:26 2015
24x48x48x8	N4quda23TwistedCloverDslashCudaI6float4S1_S1_EE	type=interior,comm=0001,ghost=0001,reconstruct=8,dagger,Dslash	128	1	1	3456	1	1	0	# 214.48 Gflop/s, 0.00 GB/s, tuned Tue Feb 24 12:04:25 2015
24x48x48x8	N4quda23TwistedCloverDslashCudaI7double2S1_S1_EE	type=exterior_t,comm=0001,reconstruct=8,Dslash	128	1	1	3456	1	1	7022	# 517.12 Gflop/s, 0.00 GB/s, tuned Mon Feb 23 18:48:30 2015
24x48x48x8	N4quda23TwistedCloverDslashCudaI7double2S1_S1_EE	type=exterior_t,comm=0001,reconstruct=8,Xpay,DslashCloverTwist	64	1	1	6912	1	1	0	# 635.26 Gflop/s, 0.00 GB/s, tuned Mon Feb 23 18:48:31 2015
24x48x48x8	N4quda23TwistedCloverDslashCudaI7double2S1_S1_EE	type=exterior_t,comm=0001,reconstruct=8,Xpay,dagger,DslashCloverTwist	64	1	1	6912	1	1	0	# 635.83 Gflop/s, 0.00 GB/s, tuned Mon Feb 23 18:48:34 2015
24x48x48x8	N4quda23TwistedCloverDslashCudaI7double2S1_S1_EE	type=exterior_t,comm=0001,reconstruct=8,dagger,Dslash	128	1	1	3456	1	1	0	# 514.75 Gflop/s, 0.00 GB/s, tuned Mon Feb 23 18:48:32 2015
24x48x48x8	N4quda23TwistedCloverDslashCudaI7double2S1_S1_EE	type=interior,comm=0001,ghost=0001,reconstruct=8,Dslash	32	1	1	13824	1	1	0	# 73.08 Gflop/s, 0.00 GB/s, tuned Mon Feb 23 18:48:30 2015
24x48x48x8	N4quda23TwistedCloverDslashCudaI7double2S1_S1_EE	type=interior,comm=0001,ghost=0001,reconstruct=8,Xpay,DslashCloverTwist	32	1	1	13824	1	1	0	# 69.23 Gflop/s, 0.00 GB/s, tuned Mon Feb 23 18:48:31 2015
24x48x48x8	N4quda23TwistedCloverDslashCudaI7double2S1_S1_EE	type=interior,comm=0001,ghost=0001,reconstruct=8,Xpay,dagger,DslashCloverTwist	32	1	1	13824	1	1	0	# 71.81 Gflop/s, 0.00 GB/s, tuned Mon Feb 23 18:48:33 2015
24x48x48x8	N4quda23TwistedCloverDslashCudaI7double2S1_S1_EE	type=interior,comm=0001,ghost=0001,reconstruct=8,dagger,Dslash	32	1	1	13824	1	1	0	# 58.80 Gflop/s, 0.00 GB/s, tuned Mon Feb 23 18:48:32 2015
24x48x48x8	N4quda25xpyHeavyQuarkResidualNormI7double37double2S2_EE	vol=442368,stride=442368,precision=8,TwistFlavour=-1	192	1	1	27	1	1	4608	# 36.38 Gflop/s, 174.61 GB/s, tuned Wed Feb 25 08:04:08 2015
24x48x48x8	N4quda25xpyHeavyQuarkResidualNormI7double37double2S2_EE	vol=442368,stride=442368,precision=8,TwistFlavour=1	128	1	1	56	1	1	3072	# 36.33 Gflop/s, 174.38 GB/s, tuned Tue Feb 24 12:06:33 2015
24x48x48x8	N4quda3DotId6float26float4EE	vol=442368,stride=442368,precision=4,TwistFlavour=-1	224	1	1	219	1	1	1792	# 44.39 Gflop/s, 177.58 GB/s, tuned Wed Feb 25 08:02:16 2015
24x48x48x8	N4quda3DotId6float26float4EE	vol=442368,stride=442368,precision=4,TwistFlavour=1	224	1	1	111	1	1	1792	# 44.35 Gflop/s, 177.40 GB/s, tuned Tue Feb 24 12:04:41 2015
24x48x48x8	N4quda3xpyI7double2S1_EE	vol=442368,stride=442368,precision=8,TwistFlavour=-1	800	1	1	251	1	1	0	# 7.37 Gflop/s, 176.81 GB/s, tuned Wed Feb 25 08:05:14 2015
24x48x48x8	N4quda3xpyI7double2S1_EE	vol=442368,stride=442368,precision=8,TwistFlavour=1	800	1	1	218	1	1	0	# 7.38 Gflop/s, 177.01 GB/s, tuned Tue Feb 24 12:07:39 2015
24x48x48x8	N4quda4axpyI6float26float4EE	vol=442368,stride=442368,precision=4,TwistFlavour=-1	544	1	1	251	1	1	0	# 29.73 Gflop/s, 178.39 GB/s, tuned Wed Feb 25 08:05:35 2015
24x48x48x8	N4quda4axpyI6float26float4EE	vol=442368,stride=442368,precision=4,TwistFlavour=1	864	1	1	252	1	1	0	# 29.73 Gflop/s, 178.37 GB/s, tuned Tue Feb 24 12:08:00 2015
24x48x48x8	N4quda4axpyI7double2S1_EE	vol=442368,stride=442368,precision=4,TwistFlavour=-1,vol=442368,stride=442368,precision=8,TwistFlavour=-1	384	1	1	8	1	1	0	# 16.73 Gflop/s, 100.36 GB/s, tuned Wed Feb 25 08:04:33 2015
24x48x48x8	N4quda4axpyI7double2S1_EE	vol=442368,stride=442368,precision=4,TwistFlavour=1,vol=442368,stride=442368,precision=8,TwistFlavour=1	32	1	1	99	1	1	0	# 16.78 Gflop/s, 100.66 GB/s, tuned Tue Feb 24 12:06:58 2015
24x48x48x8	N4quda4xpayI6float26float4EE	vol=442368,stride=442368,precision=4,TwistFlavour=-1	576	1	1	251	1	1	0	# 29.74 Gflop/s, 178.42 GB/s, tuned Wed Feb 25 08:05:55 2015
24x48x48x8	N4quda4xpayI6float26float4EE	vol=442368,stride=442368,precision=4,TwistFlavour=1	800	1	1	251	1	1	0	# 29.73 Gflop/s, 178.37 GB/s, tuned Tue Feb 24 12:08:20 2015
24x48x48x8	N4quda5Norm2Id7double2S1_EE	vol=442368,stride=442368,precision=8,TwistFlavour=-1	224	1	1	219	1	1	1792	# 42.53 Gflop/s, 170.12 GB/s, tuned Wed Feb 25 08:00:39 2015
24x48x48x8	N4quda5Norm2Id7double2S1_EE	vol=442368,stride=442368,precision=8,TwistFlavour=1	224	1	1	219	1	1	1792	# 42.43 Gflop/s, 169.71 GB/s, tuned Tue Feb 24 12:03:01 2015
24x48x48x8	N4quda8axpyZpbxI7double2S1_EE	vol=442368,stride=442368,precision=4,TwistFlavour=-1,vol=442368,stride=442368,precision=8,TwistFlavour=-1	32	1	1	123	1	1	0	# 46.45 Gflop/s, 116.14 GB/s, tuned Wed Feb 25 08:03:18 2015
24x48x48x8	N4quda8axpyZpbxI7double2S1_EE	vol=442368,stride=442368,precision=4,TwistFlavour=1,vol=442368,stride=442368,precision=8,TwistFlavour=1	32	1	1	121	1	1	0	# 46.58 Gflop/s, 116.46 GB/s, tuned Tue Feb 24 12:05:43 2015
24x48x48x8	N4quda8xmyNorm2Id7double2S1_EE	vol=442368,stride=442368,precision=8,TwistFlavour=-1	320	1	1	209	1	1	2560	# 21.51 Gflop/s, 172.11 GB/s, tuned Wed Feb 25 08:01:21 2015
24x48x48x8	N4quda8xmyNorm2Id7double2S1_EE	vol=442368,stride=442368,precision=8,TwistFlavour=1	320	1	1	210	1	1	2560	# 21.56 Gflop/s, 172.48 GB/s, tuned Tue Feb 24 12:03:43 2015
24x48x48x8	copyKernel	dst=vol=442368,stride=442368,precision=4,TwistFlavour=-1,src=vol=442368,stride=442368,precision=8,TwistFlavour=-1	864	1	1	207	1	1	0	# 0.00 Gflop/s, 174.23 GB/s, tuned Wed Feb 25 08:01:41 2015
24x48x48x8	copyKernel	dst=vol=442368,stride=442368,precision=4,TwistFlavour=1,src=vol=442368,stride=442368,precision=8,TwistFlavour=1	864	1	1	182	1	1	0	# 0.00 Gflop/s, 174.06 GB/s, tuned Tue Feb 24 12:04:03 2015
24x48x48x8	copyKernel	dst=vol=442368,stride=442368,precision=8,TwistFlavour=-1,src=vol=442368,stride=442368,precision=4,TwistFlavour=-1	1024	1	1	231	1	1	0	# 0.00 Gflop/s, 161.59 GB/s, tuned Wed Feb 25 08:03:38 2015
24x48x48x8	copyKernel	dst=vol=442368,stride=442368,precision=8,TwistFlavour=1,src=vol=442368,stride=442368,precision=4,TwistFlavour=1	1024	1	1	233	1	1	0	# 0.00 Gflop/s, 161.70 GB/s, tuned Tue Feb 24 12:06:04 2015
4x8x8x4	N4quda11axpyCGNorm2I7double26float26float4EE	vol=1024,stride=1024,precision=4,TwistFlavour=-1	32	1	1	156	1	1	1024	# 6.45 Gflop/s, 12.91 GB/s, tuned Thu Feb 19 20:53:54 2015
4x8x8x4	N4quda11axpyCGNorm2I7double26float26float4EE	vol=1024,stride=1024,precision=4,TwistFlavour=1	32	1	1	151	1	1	1024	# 6.50 Gflop/s, 13.00 GB/s, tuned Thu Feb 19 18:02:31 2015
4x8x8x4	N4quda16WilsonDslashCudaI7double2S1_EE	type=exterior_t,comm=0001,reconstruct=12,Xpay	64	1	1	16	1	1	12289	# 93.74 Gflop/s, 0.00 GB/s, tuned Thu Feb 19 18:02:24 2015
4x8x8x4	N4quda16WilsonDslashCudaI7double2S1_EE	type=interior,comm=0001,ghost=0001,reconstruct=12,Xpay	64	1	1	16	1	1	7022	# 47.38 Gflop/s, 0.00 GB/s, tuned Thu Feb 19 18:02:24 2015
4x8x8x4	N4quda21TwistCloverGamma5CudaI7double2S1_EE	vol=1024,stride=1024,precision=8,TwistFlavour=-1	96	1	1	11	1	1	7022	# 1.26 Gflop/s, 25.18 GB/s, tuned Thu Feb 19 20:53:57 2015
4x8x8x4	N4quda21TwistCloverGamma5CudaI7double2S1_EE	vol=1024,stride=1024,precision=8,TwistFlavour=1	128	1	1	8	1	1	6145	# 1.29 Gflop/s, 25.73 GB/s, tuned Thu Feb 19 18:02:24 2015
4x8x8x4	N4quda22HeavyQuarkResidualNormI7double37double2S2_EE	vol=1024,stride=1024,precision=8,TwistFlavour=-1	64	1	1	38	1	1	1536	# 3.74 Gflop/s, 14.95 GB/s, tuned Thu Feb 19 20:53:56 2015
4x8x8x4	N4quda22HeavyQuarkResidualNormI7double37double2S2_EE	vol=1024,stride=1024,precision=8,TwistFlavour=1	64	1	1	56	1	1	1536	# 3.88 Gflop/s, 15.50 GB/s, tuned Thu Feb 19 18:02:28 2015
4x8x8x4	N4quda23TwistedCloverDslashCudaI6float4S1_S1_EE	type=exterior_t,comm=0001,reconstruct=12,Dslash	64	1	1	16	1	1	8193	# 63.27 Gflop/s, 0.00 GB/s, tuned Thu Feb 19 18:02:28 2015
4x8x8x4	N4quda23TwistedCloverDslashCudaI6float4S1_S1_EE	type=exterior_t,comm=0001,reconstruct=12,Xpay,DslashCloverTwist	64	1	1	16	1	1	12289	# 76.28 Gflop/s, 0.00 GB/s, tuned Thu Feb 19 18:02:28 2015
4x8x8x4	N4quda23TwistedCloverDslashCudaI6float4S1_S1_EE	type=exterior_t,comm=0001,reconstruct=12,Xpay,dagger,DslashCloverTwist	64	1	1	16	1	1	12289	# 76.15 Gflop/s, 0.00 GB/s, tuned Thu Feb 19 18:02:28 2015
4x8x8x4	N4quda23TwistedCloverDslashCudaI6float4S1_S1_EE	type=exterior_t,comm=0001,reconstruct=12,dagger,Dslash	64	1	1	16	1	1	6145	# 63.54 Gflop/s, 0.00 GB/s, tuned Thu Feb 19 18:02:28 2015
4x8x8x4	N4quda23TwistedCloverDslashCudaI6float4S1_S1_EE	type=interior,comm=0001,ghost=0001,reconstruct=12,Dslash	96	1	1	11	1	1	7022	# 42.26 Gflop/s, 0.00 GB/s, tuned Thu Feb 19 18:02:28 2015
4x8x8x4	N4quda23TwistedCloverDslashCudaI6float4S1_S1_EE	type=interior,comm=0001,ghost=0001,reconstruct=12,Xpay,DslashCloverTwist	96	1	1	11	1	1	12289	# 46.52 Gflop/s, 0.00 GB/s, tuned Thu Feb 19 18:02:28 2015
4x8x8x4	N4quda23TwistedCloverDslashCudaI6float4S1_S1_EE	type=interior,comm=0001,ghost=0001,reconstruct=12,Xpay,dagger,DslashCloverTwist	96	1	1	11	1	1	12289	# 46.05 Gflop/s, 0.00 GB/s, tuned Thu Feb 19 18:02:28 2015
4x8x8x4	N4quda23TwistedCloverDslashCudaI6float4S1_S1_EE	type=interior,comm=0001,ghost=0001,reconstruct=12,dagger,Dslash	128	1	1	8	1	1	9831	# 42.18 Gflop/s, 0.00 GB/s, tuned Thu Feb 19 18:02:28 2015
4x8x8x4	N4quda23TwistedCloverDslashCudaI7double2S1_S1_EE	type=exterior_t,comm=0001,reconstruct=12,Dslash	64	1	1	16	1	1	9831	# 60.11 Gflop/s, 0.00 GB/s, tuned Thu Feb 19 17:31:22 2015
4x8x8x4	N4quda23TwistedCloverDslashCudaI7double2S1_S1_EE	type=exterior_t,comm=0001,reconstruct=12,Xpay,DslashCloverTwist	64	1	1	16	1	1	7022	# 70.58 Gflop/s, 0.00 GB/s, tuned Thu Feb 19 17:31:22 2015
4x8x8x4	N4quda23TwistedCloverDslashCudaI7double2S1_S1_EE	type=exterior_t,comm=0001,reconstruct=12,Xpay,dagger,DslashCloverTwist	64	1	1	16	1	1	8193	# 70.03 Gflop/s, 0.00 GB/s, tuned Thu Feb 19 17:31:22 2015
4x8x8x4	N4quda23TwistedCloverDslashCudaI7double2S1_S1_EE	type=exterior_t,comm=0001,reconstruct=12,dagger,Dslash	96	1	1	11	1	1	6145	# 59.16 Gflop/s, 0.00 GB/s, tuned Thu Feb 19 17:31:22 2015
4x8x8x4	N4quda23TwistedCloverDslashCudaI7double2S1_S1_EE	type=interior,comm=0001,ghost=0001,reconstruct=12,Dslash	64	1	1	16	1	1	0	# 31.00 Gflop/s, 0.00 GB/s, tuned Thu Feb 19 17:31:22 2015
4x8x8x4	N4quda23TwistedCloverDslashCudaI7double2S1_S1_EE	type=interior,comm=0001,ghost=0001,reconstruct=12,Xpay,DslashCloverTwist	64	1	1	16	1	1	7022	# 36.37 Gflop/s, 0.00 GB/s, tuned Thu Feb 19 17:31:22 2015
4x8x8x4	N4quda23TwistedCloverDslashCudaI7double2S1_S1_EE	type=interior,comm=0001,ghost=0001,reconstruct=12,Xpay,dagger,DslashCloverTwist	160	1	1	7	1	1	8193	# 36.45 Gflop/s, 0.00 GB/s, tuned Thu Feb 19 17:31:22 2015
4x8x8x4	N4quda23TwistedCloverDslashCudaI7double2S1_S1_EE	type=interior,comm=0001,ghost=0001,reconstruct=12,dagger,Dslash	64	1	1	16	1	1	0	# 31.04 Gflop/s, 0.00 GB/s, tuned Thu Feb 19 17:31:22 2015
4x8x8x4	N4quda25xpyHeavyQuarkResidualNormI7double37double2S2_EE	vol=1024,stride=1024,precision=8,TwistFlavour=1	32	1	1	52	1	1	1536	# 4.49 Gflop/s, 21.55 GB/s, tuned Thu Feb 19 18:02:34 2015
4x8x8x4	N4quda3DotId6float26float4EE	vol=1024,stride=1024,precision=4,TwistFlavour=-1	64	1	1	63	1	1	512	# 2.53 Gflop/s, 10.13 GB/s, tuned Thu Feb 19 20:53:52 2015
4x8x8x4	N4quda3DotId6float26float4EE	vol=1024,stride=1024,precision=4,TwistFlavour=1	32	1	1	147	1	1	512	# 2.53 Gflop/s, 10.13 GB/s, tuned Thu Feb 19 18:02:29 2015
4x8x8x4	N4quda3xpyI7double2S1_EE	vol=1024,stride=1024,precision=8,TwistFlavour=-1	64	1	1	161	1	1	0	# 3.81 Gflop/s, 91.40 GB/s, tuned Thu Feb 19 20:53:57 2015
4x8x8x4	N4quda3xpyI7double2S1_EE	vol=1024,stride=1024,precision=8,TwistFlavour=1	544	1	1	96	1	1	0	# 3.78 Gflop/s, 90.80 GB/s, tuned Thu Feb 19 18:02:35 2015
4x8x8x4	N4quda4axpyI6float26float4EE	vol=1024,stride=1024,precision=4,TwistFlavour=-1	448	1	1	62	1	1	0	# 8.04 Gflop/s, 48.25 GB/s, tuned Thu Feb 19 20:53:57 2015
4x8x8x4	N4quda4axpyI6float26float4EE	vol=1024,stride=1024,precision=4,TwistFlavour=1	96	1	1	111	1	1	0	# 8.10 Gflop/s, 48.59 GB/s, tuned Thu Feb 19 18:02:35 2015
4x8x8x4	N4quda4axpyI7double2S1_EE	vol=1024,stride=1024,precision=4,TwistFlavour=-1,vol=1024,stride=1024,precision=8,TwistFlavour=1	128	1	1	158	1	1	0	# 6.88 Gflop/s, 41.27 GB/s, tuned Thu Feb 19 20:53:55 2015
4x8x8x4	N4quda4axpyI7double2S1_EE	vol=1024,stride=1024,precision=4,TwistFlavour=1,vol=1024,stride=1024,precision=8,TwistFlavour=1	96	1	1	225	1	1	0	# 6.96 Gflop/s, 41.76 GB/s, tuned Thu Feb 19 18:02:34 2015
4x8x8x4	N4quda4xpayI6float26float4EE	vol=1024,stride=1024,precision=4,TwistFlavour=-1	160	1	1	103	1	1	0	# 8.01 Gflop/s, 48.08 GB/s, tuned Thu Feb 19 20:53:57 2015
4x8x8x4	N4quda4xpayI6float26float4EE	vol=1024,stride=1024,precision=4,TwistFlavour=1	512	1	1	14	1	1	0	# 8.17 Gflop/s, 49.02 GB/s, tuned Thu Feb 19 18:02:35 2015
4x8x8x4	N4quda5Norm2Id7double2S1_EE	vol=1024,stride=1024,precision=8,TwistFlavour=1	96	1	1	95	1	1	768	# 2.56 Gflop/s, 10.25 GB/s, tuned Thu Feb 19 18:02:25 2015
4x8x8x4	N4quda8axpyZpbxI7double2S1_EE	vol=1024,stride=1024,precision=4,TwistFlavour=-1,vol=1024,stride=1024,precision=8,TwistFlavour=1	96	1	1	244	1	1	0	# 18.11 Gflop/s, 45.27 GB/s, tuned Thu Feb 19 20:53:54 2015
4x8x8x4	N4quda8axpyZpbxI7double2S1_EE	vol=1024,stride=1024,precision=4,TwistFlavour=1,vol=1024,stride=1024,precision=8,TwistFlavour=1	96	1	1	242	1	1	0	# 18.00 Gflop/s, 45.00 GB/s, tuned Thu Feb 19 18:02:32 2015
4x8x8x4	N4quda8xmyNorm2Id7double2S1_EE	vol=1024,stride=1024,precision=8,TwistFlavour=1	96	1	1	91	1	1	768	# 3.74 Gflop/s, 29.91 GB/s, tuned Thu Feb 19 18:02:26 2015
4x8x8x4	copyKernel	dst=vol=1024,stride=1024,precision=4,TwistFlavour=-1,src=vol=1024,stride=1024,precision=8,TwistFlavour=-1	128	1	1	94	1	1	0	# 0.00 Gflop/s, 40.96 GB/s, tuned Thu Feb 19 20:53:50 2015
4x8x8x4	copyKernel	dst=vol=1024,stride=1024,precision=4,TwistFlavour=1,src=vol=1024,stride=1024,precision=8,TwistFlavour=1	64	1	1	134	1	1	0	# 0.00 Gflop/s, 41.45 GB/s, tuned Thu Feb 19 18:02:26 2015
4x8x8x4	copyKernel	dst=vol=1024,stride=1024,precision=8,TwistFlavour=-1,src=vol=1024,stride=1024,precision=4,TwistFlavour=-1	32	1	1	105	1	1	0	# 0.00 Gflop/s, 46.16 GB/s, tuned Thu Feb 19 20:53:54 2015
4x8x8x4	copyKernel	dst=vol=1024,stride=1024,precision=8,TwistFlavour=1,src=vol=1024,stride=1024,precision=4,TwistFlavour=1	96	1	1	123	1	1	0	# 0.00 Gflop/s, 46.39 GB/s, tuned Thu Feb 19 18:02:32 2015
4x8x8x8	N4quda11axpyCGNorm2I7double26float26float4EE	vol=2048,stride=2048,precision=4,TwistFlavour=-1	96	1	1	109	1	1	1536	# 12.59 Gflop/s, 25.18 GB/s, tuned Thu Feb 19 20:52:18 2015
4x8x8x8	N4quda11axpyCGNorm2I7double26float26float4EE	vol=2048,stride=2048,precision=4,TwistFlavour=1	32	1	1	157	1	1	1024	# 12.57 Gflop/s, 25.15 GB/s, tuned Thu Feb 19 18:04:53 2015
4x8x8x8	N4quda16WilsonDslashCudaI7double2S1_EE	type=interior,comm=0000,ghost=0000,reconstruct=12,Xpay	320	1	1	7	1	1	12289	# 61.40 Gflop/s, 0.00 GB/s, tuned Thu Feb 19 18:04:46 2015
4x8x8x8	N4quda17TwistedDslashCudaI7double2S1_EE	type=interior,comm=0000,ghost=0000,reconstruct=12,	192	1	1	11	1	1	9831	# 67.44 Gflop/s, 0.00 GB/s, tuned Thu Feb 19 15:47:36 2015
4x8x8x8	N4quda17TwistedDslashCudaI7double2S1_EE	type=interior,comm=0000,ghost=0000,reconstruct=12,Xpay,DslashTwist	320	1	1	7	1	1	7022	# 63.69 Gflop/s, 0.00 GB/s, tuned Thu Feb 19 15:47:36 2015
4x8x8x8	N4quda17TwistedDslashCudaI7double2S1_EE	type=interior,comm=0000,ghost=0000,reconstruct=12,Xpay,dagger,DslashTwist	192	1	1	11	1	1	6145	# 63.95 Gflop/s, 0.00 GB/s, tuned Thu Feb 19 15:47:36 2015
4x8x8x8	N4quda17TwistedDslashCudaI7double2S1_EE	type=interior,comm=0000,ghost=0000,reconstruct=12,dagger,	64	1	1	32	1	1	0	# 67.64 Gflop/s, 0.00 GB/s, tuned Thu Feb 19 15:47:36 2015
4x8x8x8	N4quda21TwistCloverGamma5CudaI7double2S1_EE	vol=2048,stride=2048,precision=8,TwistFlavour=-1	128	1	1	16	1	1	0	# 1.67 Gflop/s, 26.77 GB/s, tuned Thu Feb 19 20:52:22 2015
4x8x8x8	N4quda21TwistCloverGamma5CudaI7double2S1_EE	vol=2048,stride=2048,precision=8,TwistFlavour=1	160	1	1	13	1	1	0	# 1.67 Gflop/s, 26.74 GB/s, tuned Thu Feb 19 18:04:46 2015
4x8x8x8	N4quda22HeavyQuarkResidualNormI7double37double2S2_EE	vol=2048,stride=2048,precision=8,TwistFlavour=-1	32	1	1	80	1	1	1536	# 7.11 Gflop/s, 28.42 GB/s, tuned Thu Feb 19 20:52:21 2015
4x8x8x8	N4quda22HeavyQuarkResidualNormI7double37double2S2_EE	vol=2048,stride=2048,precision=8,TwistFlavour=1	64	1	1	60	1	1	1536	# 7.27 Gflop/s, 29.06 GB/s, tuned Thu Feb 19 18:04:50 2015
4x8x8x8	N4quda23TwistedCloverDslashCudaI6float4S1_S1_EE	type=interior,comm=0000,ghost=0000,reconstruct=12,Dslash	96	1	1	22	1	1	0	# 58.00 Gflop/s, 0.00 GB/s, tuned Thu Feb 19 18:04:50 2015
4x8x8x8	N4quda23TwistedCloverDslashCudaI6float4S1_S1_EE	type=interior,comm=0000,ghost=0000,reconstruct=12,Xpay,DslashCloverTwist	96	1	1	22	1	1	16385	# 64.55 Gflop/s, 0.00 GB/s, tuned Thu Feb 19 18:04:50 2015
4x8x8x8	N4quda23TwistedCloverDslashCudaI6float4S1_S1_EE	type=interior,comm=0000,ghost=0000,reconstruct=12,Xpay,dagger,DslashCloverTwist	64	1	1	32	1	1	0	# 64.46 Gflop/s, 0.00 GB/s, tuned Thu Feb 19 18:04:50 2015
4x8x8x8	N4quda23TwistedCloverDslashCudaI6float4S1_S1_EE	type=interior,comm=0000,ghost=0000,reconstruct=12,dagger,Dslash	64	1	1	32	1	1	0	# 57.40 Gflop/s, 0.00 GB/s, tuned Thu Feb 19 18:04:50 2015
4x8x8x8	N4quda23TwistedCloverDslashCudaI7double2S1_S1_EE	type=interior,comm=0000,ghost=0000,reconstruct=12,Dslash	192	1	1	11	1	1	16385	# 43.10 Gflop/s, 0.00 GB/s, tuned Thu Feb 19 16:03:23 2015
4x8x8x8	N4quda23TwistedCloverDslashCudaI7double2S1_S1_EE	type=interior,comm=0000,ghost=0000,reconstruct=12,Xpay,DslashCloverTwist	320	1	1	7	1	1	9831	# 50.86 Gflop/s, 0.00 GB/s, tuned Thu Feb 19 16:03:23 2015
4x8x8x8	N4quda23TwistedCloverDslashCudaI7double2S1_S1_EE	type=interior,comm=0000,ghost=0000,reconstruct=12,Xpay,dagger,DslashCloverTwist	320	1	1	7	1	1	8193	# 51.37 Gflop/s, 0.00 GB/s, tuned Thu Feb 19 16:03:23 2015
4x8x8x8	N4quda23TwistedCloverDslashCudaI7double2S1_S1_EE	type=interior,comm=0000,ghost=0000,reconstruct=12,dagger,Dslash	192	1	1	11	1	1	6145	# 43.69 Gflop/s, 0.00 GB/s, tuned Thu Feb 19 16:03:23 2015
4x8x8x8	N4quda25xpyHeavyQuarkResidualNormI7double37double2S2_EE	vol=2048,stride=2048,precision=8,TwistFlavour=1	32	1	1	94	1	1	1536	# 8.50 Gflop/s, 40.81 GB/s, tuned Thu Feb 19 18:04:56 2015
4x8x8x8	N4quda3DotId6float26float4EE	vol=2048,stride=2048,precision=4,TwistFlavour=-1	96	1	1	109	1	1	768	# 4.87 Gflop/s, 19.48 GB/s, tuned Thu Feb 19 20:52:16 2015
4x8x8x8	N4quda3DotId6float26float4EE	vol=2048,stride=2048,precision=4,TwistFlavour=1	96	1	1	92	1	1	768	# 4.93 Gflop/s, 19.72 GB/s, tuned Thu Feb 19 18:04:51 2015
4x8x8x8	N4quda3xpyI7double2S1_EE	vol=2048,stride=2048,precision=8,TwistFlavour=-1	64	1	1	136	1	1	0	# 6.66 Gflop/s, 159.82 GB/s, tuned Thu Feb 19 20:52:22 2015
4x8x8x8	N4quda3xpyI7double2S1_EE	vol=2048,stride=2048,precision=8,TwistFlavour=1	64	1	1	132	1	1	0	# 6.63 Gflop/s, 159.13 GB/s, tuned Thu Feb 19 18:04:57 2015
4x8x8x8	N4quda4axpyI6float26float4EE	vol=2048,stride=2048,precision=4,TwistFlavour=-1	64	1	1	184	1	1	0	# 15.08 Gflop/s, 90.50 GB/s, tuned Thu Feb 19 20:52:22 2015
4x8x8x8	N4quda4axpyI6float26float4EE	vol=2048,stride=2048,precision=4,TwistFlavour=1	288	1	1	228	1	1	0	# 15.18 Gflop/s, 91.10 GB/s, tuned Thu Feb 19 18:04:57 2015
4x8x8x8	N4quda4axpyI7double2S1_EE	vol=2048,stride=2048,precision=4,TwistFlavour=-1,vol=2048,stride=2048,precision=8,TwistFlavour=1	160	1	1	107	1	1	0	# 12.47 Gflop/s, 74.83 GB/s, tuned Thu Feb 19 20:52:20 2015
4x8x8x8	N4quda4axpyI7double2S1_EE	vol=2048,stride=2048,precision=4,TwistFlavour=1,vol=2048,stride=2048,precision=8,TwistFlavour=1	160	1	1	126	1	1	0	# 12.45 Gflop/s, 74.72 GB/s, tuned Thu Feb 19 18:04:57 2015
4x8x8x8	N4quda4xpayI6float26float4EE	vol=2048,stride=2048,precision=4,TwistFlavour=-1	224	1	1	190	1	1	0	# 14.91 Gflop/s, 89.48 GB/s, tuned Thu Feb 19 20:52:22 2015
4x8x8x8	N4quda4xpayI6float26float4EE	vol=2048,stride=2048,precision=4,TwistFlavour=1	224	1	1	214	1	1	0	# 15.28 Gflop/s, 91.70 GB/s, tuned Thu Feb 19 18:04:57 2015
4x8x8x8	N4quda5Norm2Id7double2S1_EE	vol=2048,stride=2048,precision=8,TwistFlavour=1	128	1	1	83	1	1	1024	# 5.00 Gflop/s, 19.99 GB/s, tuned Thu Feb 19 18:04:47 2015
4x8x8x8	N4quda8axpyZpbxI7double2S1_EE	vol=2048,stride=2048,precision=4,TwistFlavour=-1,vol=2048,stride=2048,precision=8,TwistFlavour=1	160	1	1	59	1	1	0	# 31.64 Gflop/s, 79.11 GB/s, tuned Thu Feb 19 20:52:19 2015
4x8x8x8	N4quda8axpyZpbxI7double2S1_EE	vol=2048,stride=2048,precision=4,TwistFlavour=1,vol=2048,stride=2048,precision=8,TwistFlavour=1	160	1	1	93	1	1	0	# 31.64 Gflop/s, 79.11 GB/s, tuned Thu Feb 19 18:04:54 2015
4x8x8x8	N4quda8xmyNorm2Id7double2S1_EE	vol=2048,stride=2048,precision=8,TwistFlavour=1	96	1	1	90	1	1	768	# 6.98 Gflop/s, 55.83 GB/s, tuned Thu Feb 19 18:04:48 2015
4x8x8x8	copyKernel	dst=vol=2048,stride=2048,precision=4,TwistFlavour=-1,src=vol=2048,stride=2048,precision=8,TwistFlavour=-1	128	1	1	232	1	1	0	# 0.00 Gflop/s, 78.99 GB/s, tuned Thu Feb 19 20:52:15 2015
4x8x8x8	copyKernel	dst=vol=2048,stride=2048,precision=4,TwistFlavour=1,src=vol=2048,stride=2048,precision=8,TwistFlavour=1	128	1	1	184	1	1	0	# 0.00 Gflop/s, 78.77 GB/s, tuned Thu Feb 19 18:04:48 2015
4x8x8x8	copyKernel	dst=vol=2048,stride=2048,precision=8,TwistFlavour=-1,src=vol=2048,stride=2048,precision=4,TwistFlavour=-1	160	1	1	240	1	1	0	# 0.00 Gflop/s, 86.67 GB/s, tuned Thu Feb 19 20:52:19 2015
4x8x8x8	copyKernel	dst=vol=2048,stride=2048,precision=8,TwistFlavour=1,src=vol=2048,stride=2048,precision=4,TwistFlavour=1	160	1	1	214	1	1	0	# 0.00 Gflop/s, 86.40 GB/s, tuned Thu Feb 19 18:04:54 2015
8x16x16x32	N4quda10CovDevCudaId7double2EE	type=interior,comm=0000,ghost=0000,reconstruct=8	240	1	1	274	1	1	7022	# 51.81 Gflop/s, 0.00 GB/s, tuned Wed Jun  3 14:08:56 2015
8x16x16x32	N4quda10CovDevCudaId7double2EE	type=interior,comm=0000,ghost=0000,reconstruct=8,dagger	120	1	1	547	1	1	0	# 51.59 Gflop/s, 0.00 GB/s, tuned Wed Jun  3 14:08:56 2015
8x16x16x32	N4quda10Gamma5CudaI7double2EE	type=default	576	1	1	114	1	1	7022	# 5.20 Gflop/s, 166.48 GB/s, tuned Thu Feb 26 15:00:42 2015
8x16x16x32	N4quda11axpyCGNorm2I7double26float26float4EE	vol=65536,stride=65536,precision=4,TwistFlavour=-1	64	1	1	168	1	1	1024	# 71.18 Gflop/s, 142.35 GB/s, tuned Thu Feb 26 15:00:07 2015
8x16x16x32	N4quda11axpyCGNorm2I7double26float26float4EE	vol=65536,stride=65536,precision=4,TwistFlavour=1	128	1	1	98	1	1	2048	# 71.45 Gflop/s, 142.91 GB/s, tuned Mon Jun  8 16:13:08 2015
8x16x16x32	N4quda12ContractCudaI7double2S1_EE	type=gamma5	96	1	1	683	1	1	24576	# 13.57 Gflop/s, 43.41 GB/s, tuned Thu Feb 26 15:00:42 2015
8x16x16x32	N4quda12ContractCudaI7double2S1_EE	type=gamma5-minus	96	1	1	683	1	1	24576	# 7.89 Gflop/s, 25.25 GB/s, tuned Wed Jun  3 14:08:56 2015
8x16x16x32	N4quda12ContractCudaI7double2S1_EE	type=gamma5-plus	96	1	1	683	1	1	24576	# 7.85 Gflop/s, 25.13 GB/s, tuned Wed Jun  3 14:08:56 2015
8x16x16x32	N4quda12ContractCudaI7double2S1_EE	type=plain	96	1	1	683	1	1	24576	# 12.32 Gflop/s, 39.41 GB/s, tuned Mon Jun  8 16:13:43 2015
8x16x16x32	N4quda12ContractCudaI7double2S1_EE	type=plain-minus	96	1	1	683	1	1	24576	# 7.98 Gflop/s, 25.53 GB/s, tuned Mon Jun  8 16:13:43 2015
8x16x16x32	N4quda12ContractCudaI7double2S1_EE	type=plain-plus	96	1	1	683	1	1	24576	# 7.95 Gflop/s, 25.44 GB/s, tuned Mon Jun  8 16:13:43 2015
8x16x16x32	N4quda15TwistGamma5CudaI7double2EE	vol=65536,stride=65536,precision=8,TwistFlavour=-1	640	1	1	103	1	1	9831	# 10.30 Gflop/s, 164.77 GB/s, tuned Fri Jun  5 10:27:54 2015
8x16x16x32	N4quda16WilsonDslashCudaI7double2S1_EE	type=interior,comm=0000,ghost=0000,reconstruct=8,Xpay	64	1	1	1024	1	1	0	# 127.83 Gflop/s, 0.00 GB/s, tuned Thu Feb 26 14:59:40 2015
8x16x16x32	N4quda17TwistedDslashCudaI6float4S1_EE	type=interior,comm=0000,ghost=0000,reconstruct=8,	128	1	1	512	1	1	0	# 358.73 Gflop/s, 0.00 GB/s, tuned Fri Jun  5 10:27:55 2015
8x16x16x32	N4quda17TwistedDslashCudaI6float4S1_EE	type=interior,comm=0000,ghost=0000,reconstruct=8,Xpay,DslashTwist	160	1	1	410	1	1	0	# 317.25 Gflop/s, 0.00 GB/s, tuned Fri Jun  5 10:27:55 2015
8x16x16x32	N4quda17TwistedDslashCudaI6float4S1_EE	type=interior,comm=0000,ghost=0000,reconstruct=8,Xpay,dagger,DslashTwist	64	1	1	1024	1	1	0	# 318.54 Gflop/s, 0.00 GB/s, tuned Fri Jun  5 10:27:55 2015
8x16x16x32	N4quda17TwistedDslashCudaI6float4S1_EE	type=interior,comm=0000,ghost=0000,reconstruct=8,dagger,	64	1	1	1024	1	1	0	# 351.78 Gflop/s, 0.00 GB/s, tuned Fri Jun  5 10:27:55 2015
8x16x16x32	N4quda17TwistedDslashCudaI7double2S1_EE	type=interior,comm=0000,ghost=0000,reconstruct=8,	128	1	1	512	1	1	0	# 141.00 Gflop/s, 0.00 GB/s, tuned Fri Jun  5 10:27:54 2015
8x16x16x32	N4quda17TwistedDslashCudaI7double2S1_EE	type=interior,comm=0000,ghost=0000,reconstruct=8,Xpay,DslashTwist	128	1	1	512	1	1	0	# 131.02 Gflop/s, 0.00 GB/s, tuned Fri Jun  5 10:27:55 2015
8x16x16x32	N4quda17TwistedDslashCudaI7double2S1_EE	type=interior,comm=0000,ghost=0000,reconstruct=8,Xpay,dagger,DslashTwist	64	1	1	1024	1	1	0	# 131.08 Gflop/s, 0.00 GB/s, tuned Fri Jun  5 10:27:54 2015
8x16x16x32	N4quda17TwistedDslashCudaI7double2S1_EE	type=interior,comm=0000,ghost=0000,reconstruct=8,dagger,	96	1	1	683	1	1	0	# 137.26 Gflop/s, 0.00 GB/s, tuned Fri Jun  5 10:27:54 2015
8x16x16x32	N4quda20AsymCloverDslashCudaI7double2S1_S1_EE	type=interior,comm=0000,ghost=0000,reconstruct=8,Xpay	64	1	1	1024	1	1	0	# 86.05 Gflop/s, 0.00 GB/s, tuned Thu Feb 26 15:00:42 2015
8x16x16x32	N4quda21TwistCloverGamma5CudaI7double2S1_EE	vol=65536,stride=65536,precision=8,TwistFlavour=-1	384	1	1	171	1	1	0	# 2.68 Gflop/s, 42.89 GB/s, tuned Thu Feb 26 14:59:40 2015
8x16x16x32	N4quda21TwistCloverGamma5CudaI7double2S1_EE	vol=65536,stride=65536,precision=8,TwistFlavour=1	384	1	1	171	1	1	7022	# 2.67 Gflop/s, 42.79 GB/s, tuned Mon Jun  8 16:13:41 2015
8x16x16x32	N4quda22HeavyQuarkResidualNormI7double37double2S2_EE	vol=65536,stride=65536,precision=8,TwistFlavour=-1	96	1	1	54	1	1	2304	# 38.21 Gflop/s, 152.84 GB/s, tuned Thu Feb 26 14:59:58 2015
8x16x16x32	N4quda22HeavyQuarkResidualNormI7double37double2S2_EE	vol=65536,stride=65536,precision=8,TwistFlavour=1	64	1	1	109	1	1	1536	# 37.73 Gflop/s, 150.92 GB/s, tuned Mon Jun  8 16:13:25 2015
8x16x16x32	N4quda23TwistedCloverDslashCudaI6float4S1_S1_EE	type=interior,comm=0000,ghost=0000,reconstruct=8,Dslash	64	1	1	1024	1	1	0	# 189.26 Gflop/s, 0.00 GB/s, tuned Thu Feb 26 14:59:58 2015
8x16x16x32	N4quda23TwistedCloverDslashCudaI6float4S1_S1_EE	type=interior,comm=0000,ghost=0000,reconstruct=8,Xpay,DslashCloverTwist	192	1	1	342	1	1	0	# 225.80 Gflop/s, 0.00 GB/s, tuned Thu Feb 26 14:59:59 2015
8x16x16x32	N4quda23TwistedCloverDslashCudaI6float4S1_S1_EE	type=interior,comm=0000,ghost=0000,reconstruct=8,Xpay,dagger,DslashCloverTwist	320	1	1	205	1	1	6145	# 226.74 Gflop/s, 0.00 GB/s, tuned Thu Feb 26 14:59:59 2015
8x16x16x32	N4quda23TwistedCloverDslashCudaI6float4S1_S1_EE	type=interior,comm=0000,ghost=0000,reconstruct=8,dagger,Dslash	128	1	1	512	1	1	0	# 187.92 Gflop/s, 0.00 GB/s, tuned Thu Feb 26 14:59:59 2015
8x16x16x32	N4quda23TwistedCloverDslashCudaI7double2S1_S1_EE	type=interior,comm=0000,ghost=0000,reconstruct=8,Dslash	192	1	1	342	1	1	0	# 61.42 Gflop/s, 0.00 GB/s, tuned Thu Feb 26 14:59:44 2015
8x16x16x32	N4quda23TwistedCloverDslashCudaI7double2S1_S1_EE	type=interior,comm=0000,ghost=0000,reconstruct=8,Xpay,DslashCloverTwist	128	1	1	512	1	1	0	# 61.49 Gflop/s, 0.00 GB/s, tuned Thu Feb 26 14:59:44 2015
8x16x16x32	N4quda23TwistedCloverDslashCudaI7double2S1_S1_EE	type=interior,comm=0000,ghost=0000,reconstruct=8,Xpay,dagger,DslashCloverTwist	32	1	1	2048	1	1	0	# 61.05 Gflop/s, 0.00 GB/s, tuned Thu Feb 26 14:59:40 2015
8x16x16x32	N4quda23TwistedCloverDslashCudaI7double2S1_S1_EE	type=interior,comm=0000,ghost=0000,reconstruct=8,dagger,Dslash	128	1	1	512	1	1	16385	# 50.20 Gflop/s, 0.00 GB/s, tuned Thu Feb 26 14:59:40 2015
8x16x16x32	N4quda25xpyHeavyQuarkResidualNormI7double37double2S2_EE	vol=65536,stride=65536,precision=8,TwistFlavour=-1	64	1	1	111	1	1	1536	# 33.21 Gflop/s, 159.43 GB/s, tuned Thu Feb 26 15:00:22 2015
8x16x16x32	N4quda3DotId6float26float4EE	vol=65536,stride=65536,precision=4,TwistFlavour=-1	192	1	1	108	1	1	1536	# 35.54 Gflop/s, 142.16 GB/s, tuned Thu Feb 26 15:00:02 2015
8x16x16x32	N4quda3DotId6float26float4EE	vol=65536,stride=65536,precision=4,TwistFlavour=1	160	1	1	136	1	1	1280	# 35.60 Gflop/s, 142.42 GB/s, tuned Mon Jun  8 16:13:03 2015
8x16x16x32	N4quda3xpyI7double2S1_EE	vol=65536,stride=65536,precision=8,TwistFlavour=-1	576	1	1	242	1	1	0	# 7.42 Gflop/s, 178.11 GB/s, tuned Thu Feb 26 15:00:32 2015
8x16x16x32	N4quda3xpyI7double2S1_EE	vol=65536,stride=65536,precision=8,TwistFlavour=1	896	1	1	249	1	1	0	# 7.40 Gflop/s, 177.67 GB/s, tuned Mon Jun  8 16:13:41 2015
8x16x16x32	N4quda4axpyI6float26float4EE	vol=65536,stride=65536,precision=4,TwistFlavour=-1	1024	1	1	244	1	1	0	# 29.14 Gflop/s, 174.85 GB/s, tuned Thu Feb 26 15:00:35 2015
8x16x16x32	N4quda4axpyI6float26float4EE	vol=65536,stride=65536,precision=4,TwistFlavour=1	640	1	1	251	1	1	0	# 29.11 Gflop/s, 174.64 GB/s, tuned Mon Jun  8 16:13:28 2015
8x16x16x32	N4quda4axpyI7double2S1_EE	vol=65536,stride=65536,precision=4,TwistFlavour=-1,vol=65536,stride=65536,precision=8,TwistFlavour=-1	576	1	1	118	1	1	0	# 17.37 Gflop/s, 104.23 GB/s, tuned Thu Feb 26 15:00:25 2015
8x16x16x32	N4quda4axpyI7double2S1_EE	vol=65536,stride=65536,precision=4,TwistFlavour=1,vol=65536,stride=65536,precision=8,TwistFlavour=-1	576	1	1	124	1	1	0	# 17.39 Gflop/s, 104.35 GB/s, tuned Mon Jun  8 16:13:21 2015
8x16x16x32	N4quda4xpayI6float26float4EE	vol=65536,stride=65536,precision=4,TwistFlavour=-1	1024	1	1	253	1	1	0	# 29.18 Gflop/s, 175.07 GB/s, tuned Thu Feb 26 15:00:38 2015
8x16x16x32	N4quda4xpayI6float26float4EE	vol=65536,stride=65536,precision=4,TwistFlavour=1	608	1	1	243	1	1	0	# 29.13 Gflop/s, 174.80 GB/s, tuned Mon Jun  8 16:13:31 2015
8x16x16x32	N4quda5Norm2Id7double2S1_EE	vol=65536,stride=65536,precision=8,TwistFlavour=-1	224	1	1	111	1	1	1792	# 34.13 Gflop/s, 136.50 GB/s, tuned Thu Feb 26 14:59:44 2015
8x16x16x32	N4quda8axpyZpbxI7double2S1_EE	vol=65536,stride=65536,precision=4,TwistFlavour=-1,vol=65536,stride=65536,precision=8,TwistFlavour=-1	64	1	1	64	1	1	0	# 46.93 Gflop/s, 117.32 GB/s, tuned Thu Feb 26 15:00:13 2015
8x16x16x32	N4quda8axpyZpbxI7double2S1_EE	vol=65536,stride=65536,precision=4,TwistFlavour=1,vol=65536,stride=65536,precision=8,TwistFlavour=-1	64	1	1	64	1	1	0	# 46.93 Gflop/s, 117.33 GB/s, tuned Mon Jun  8 16:13:14 2015
8x16x16x32	N4quda8xmyNorm2Id7double2S1_EE	vol=65536,stride=65536,precision=8,TwistFlavour=-1	96	1	1	216	1	1	768	# 20.46 Gflop/s, 163.71 GB/s, tuned Thu Feb 26 14:59:51 2015
8x16x16x32	copyKernel	dst=vol=65536,stride=65536,precision=4,TwistFlavour=-1,src=vol=65536,stride=65536,precision=8,TwistFlavour=-1	320	1	1	238	1	1	0	# 0.00 Gflop/s, 171.10 GB/s, tuned Thu Feb 26 14:59:54 2015
8x16x16x32	copyKernel	dst=vol=65536,stride=65536,precision=4,TwistFlavour=1,src=vol=65536,stride=65536,precision=8,TwistFlavour=1	320	1	1	253	1	1	0	# 0.00 Gflop/s, 171.21 GB/s, tuned Mon Jun  8 16:13:00 2015
8x16x16x32	copyKernel	dst=vol=65536,stride=65536,precision=8,TwistFlavour=-1,src=vol=65536,stride=65536,precision=4,TwistFlavour=-1	576	1	1	246	1	1	0	# 0.00 Gflop/s, 169.81 GB/s, tuned Thu Feb 26 15:00:16 2015
8x16x16x32	copyKernel	dst=vol=65536,stride=65536,precision=8,TwistFlavour=1,src=vol=65536,stride=65536,precision=4,TwistFlavour=1	576	1	1	181	1	1	0	# 0.00 Gflop/s, 168.83 GB/s, tuned Mon Jun  8 16:13:17 2015
